{"artifact_hash_contract":"SHA256_EXACT_FILE_BYTES","artifact_id":"A1-SUPPLEMENT-FI22-SENSITIVITY-01","artifact_path":"outputs/tables/A1/A1-SUPPLEMENT-FI22-SENSITIVITY-01/r0001/A1-SUPPLEMENT-FI22-SENSITIVITY-01.csv","artifact_revision":1,"artifact_sha256":"218f26e8eea14eee33891f2a995f42d523ddab00e60c24758c0e83350c560081","artifact_type":"TABLE","execution_identity_sha256":"7e00bc591c4f9653a93100fb2f8fc31251456c3306c4b4ef13d49464a45536de","generator_path":"scripts/K50/K50.r","generator_repository_revision":"417290f223c0beef054410ee2b8135277dae93e3","generator_sha256":"03d7e68a11eb3e49135df023016736b1c2b20336e77e3af9ca5bddee8d12a42a","receipt_classification":"PUBLIC_SYNTHETIC_VALIDATION","receipt_id":"A1-SUPPLEMENT-FI22-SENSITIVITY-01-R0001-PROMOTION","schema_version":"1.0.0","supporting_evidence":[],"synthetic_disclaimer":"Synthetic structural-validation evidence only; not study findings.","synthetic_input_bindings":[{"control_reference":"data/synthetic/k50_wide_authoritative_test_control.lock","control_sha256":"f55c93bbc94d8e09ceb0b1739951bcfffbce964ec9abbbd0c7602143a61d0d89","input_classification":"PUBLIC_SYNTHETIC_INPUT","input_reference":"data/synthetic/k50_wide_structural_fixture.csv","input_sha256":"fa0e93b789f7f4df3522798bafc4d94e131a04912707173727e4107c3350da34"}],"timestamp_policy":"OMITTED_FROM_CANONICAL_IDENTITY","validated_checks":["ARTIFACT_HASH_MATCH","GENERATOR_IDENTITY_MATCH","SYNTHETIC_BOUNDARY_PASS","SYNTHETIC_INPUT_CONTROL_MATCH","TABLE_SCHEMA_PASS","VALIDATOR_IDENTITY_MATCH"],"validation_profile":"SINGLE_FILE_TABLE_V1","validation_result":"PASS","validator_path":"scripts/validation/validate_synthetic_promotion.py","validator_repository_revision":"48086c99336bbe458752dc0aeca5128f8a7fdab9","validator_sha256":"ccc3ceb55969b9b51b287b2339aeb6f984225c0bac4bfa7178d6714f04317174"}
