{"artifact_hash_contract":"SHA256_EXACT_BUNDLE_MANIFEST_BYTES","artifact_id":"A1-SUPPLEMENT-QC-PROVENANCE-01","artifact_path":"outputs/tables/A1/A1-SUPPLEMENT-QC-PROVENANCE-01/r0001/bundle/bundle_manifest.json","artifact_revision":1,"artifact_sha256":"8184358b21c724b7635105e018f53d161f0e09700e53becf17795afbc29be434","artifact_type":"SUPPLEMENT","execution_identity_sha256":"a5e22f259856d9f841ba64e3c6a16ce006fb81d0d1cc84b73d3cafbd05cd3807","generator_path":"scripts/demo/build_qc_provenance_bundle.py","generator_repository_revision":"bfc88f19d9e53a742cd86f1702e65de6400a3cce","generator_sha256":"a17b7a315f2184005ec4489e10b23c95bf3da07e38de2d5b31e5b3de4c6bb3f6","receipt_classification":"PUBLIC_SYNTHETIC_VALIDATION","receipt_id":"A1-SUPPLEMENT-QC-PROVENANCE-01-R0001-PROMOTION","schema_version":"1.0.0","supporting_evidence":[{"classification":"PUBLIC_SYNTHETIC_VALIDATION_EVIDENCE","reference":"outputs/tables/A1/A1-SUPPLEMENT-QC-PROVENANCE-01/r0001/bundle/validation_receipt.json","sha256":"2baf6a8fb6ad0e86a01741017a7cbe46454533f3ab4306b391d8ac205d5d470c"}],"synthetic_disclaimer":"Synthetic structural-validation evidence only; not study findings.","synthetic_input_bindings":[{"control_reference":"data/synthetic/k50_wide_authoritative_test_control.lock","control_sha256":"f55c93bbc94d8e09ceb0b1739951bcfffbce964ec9abbbd0c7602143a61d0d89","input_classification":"PUBLIC_SYNTHETIC_INPUT","input_reference":"data/synthetic/k50_wide_structural_fixture.csv","input_sha256":"fa0e93b789f7f4df3522798bafc4d94e131a04912707173727e4107c3350da34"}],"timestamp_policy":"OMITTED_FROM_CANONICAL_IDENTITY","validated_checks":["ARTIFACT_HASH_MATCH","BUNDLE_CONTRACT_PASS","GENERATOR_IDENTITY_MATCH","SYNTHETIC_BOUNDARY_PASS","SYNTHETIC_INPUT_CONTROL_MATCH","VALIDATOR_IDENTITY_MATCH"],"validation_profile":"QC_PROVENANCE_BUNDLE_V1","validation_result":"PASS","validator_path":"scripts/validation/validate_synthetic_promotion.py","validator_repository_revision":"48086c99336bbe458752dc0aeca5128f8a7fdab9","validator_sha256":"ccc3ceb55969b9b51b287b2339aeb6f984225c0bac4bfa7178d6714f04317174"}
