{"artifact_hash_contract":"SHA256_EXACT_FILE_BYTES","artifact_id":"TEST-TABLE-SYNTHETIC-01","artifact_path":"CANONICAL_ROOT/artifact.csv","artifact_revision":1,"artifact_sha256":"aaaaaaaaaaaaaaaaaaaaaaaaaaaaaaaaaaaaaaaaaaaaaaaaaaaaaaaaaaaaaaaa","artifact_type":"TABLE","execution_identity_sha256":"bbbbbbbbbbbbbbbbbbbbbbbbbbbbbbbbbbbbbbbbbbbbbbbbbbbbbbbbbbbbbbbb","generator_path":"scripts/K50/K50.r","generator_repository_revision":"cccccccccccccccccccccccccccccccccccccccc","generator_sha256":"dddddddddddddddddddddddddddddddddddddddddddddddddddddddddddddddd","receipt_classification":"PUBLIC_SYNTHETIC_VALIDATION","receipt_id":"TEST-RECEIPT-SYNTHETIC-01","schema_version":"1.0.0","supporting_evidence":[],"synthetic_disclaimer":"Synthetic structural-validation evidence only; not study findings.","synthetic_input_bindings":[{"control_reference":"data/synthetic/control.lock","control_sha256":"eeeeeeeeeeeeeeeeeeeeeeeeeeeeeeeeeeeeeeeeeeeeeeeeeeeeeeeeeeeeeeee","input_classification":"PUBLIC_SYNTHETIC_INPUT","input_reference":"data/synthetic/input.csv","input_sha256":"ffffffffffffffffffffffffffffffffffffffffffffffffffffffffffffffff"}],"timestamp_policy":"OMITTED_FROM_CANONICAL_IDENTITY","validated_checks":["ARTIFACT_HASH_MATCH","GENERATOR_IDENTITY_MATCH","SYNTHETIC_BOUNDARY_PASS","SYNTHETIC_INPUT_CONTROL_MATCH","TABLE_SCHEMA_PASS","VALIDATOR_IDENTITY_MATCH"],"validation_profile":"SINGLE_FILE_TABLE_V1","validation_result":"PASS","validator_path":"scripts/validation/validate_artifact_registry.py","validator_repository_revision":"cccccccccccccccccccccccccccccccccccccccc","validator_sha256":"dddddddddddddddddddddddddddddddddddddddddddddddddddddddddddddddd"}
